{
  "readiness_version": "1.0",
  "assessment_id": "synthetic-pilot-readiness-v1",
  "assessed_at": "2026-09-18T00:00:00Z",
  "scope": {
    "mission_id": "SOLID_PRIVACY_PLATFORM",
    "mission_revision": "2026-09-02-r3",
    "gap_id": "SPP-GAP-50",
    "repository": "solidprivacy-nl/solidprivacy"
  },
  "status": "READY",
  "gates": {
    "workflow_model": {
      "status": "PASS",
      "evidence_refs": ["docs/workpackages/MISSION_SPP_R2_GAP_30.md"],
      "rationale": "Recurring and standalone assignments share the governed workflow model."
    },
    "evidence_provenance": {
      "status": "PASS",
      "evidence_refs": ["docs/workpackages/MISSION_SPP_R3_GAP_40.md", "tests/test_review_provenance.py"],
      "rationale": "Evidence identity and stale-review prevention are deterministic."
    },
    "human_professional_review": {
      "status": "PASS",
      "evidence_refs": ["contracts/human_review.schema.json", "tests/test_review_provenance.py"],
      "rationale": "Material final conclusions require an attributable HUMAN approval bound to exact reviewed content."
    },
    "source_lineage": {
      "status": "PASS",
      "evidence_refs": ["contracts/source_reference.schema.json", "legal_sources/source_registry.yaml"],
      "rationale": "Current source provenance is explicit and machine-validatable."
    },
    "synthetic_pilot_validation": {
      "status": "PASS",
      "evidence_refs": ["evals/synthetic_cases/dpia_nl_basic.json", "evals/synthetic_cases/dpia_nl_high_risk.json"],
      "rationale": "Synthetic cases exercise the governed contracts without introducing real-client data."
    }
  },
  "blockers": [],
  "decisions": [
    {
      "id": "pilot-data-boundary",
      "status": "RESOLVED",
      "description": "GAP-50 readiness proof remains synthetic and grants no real-client-data authority.",
      "owner": "SolidPrivacy governance"
    }
  ]
}
